{
  "$schema": "./site.schema.json",
  "name": "AmbleLabs",
  "tagline": "A Minecraft Mod and Game Development Studio.",
  "description": "We are a small Development team that mainly focuses on making mods for Minecraft revolving around Doctor Who, Stargate, and Super Heroes!",
  "youtube_embed": "5Wvh-TaVLm8",
  "commissions": "https://docs.google.com/forms/d/e/1FAIpQLSddNEX7eRlWgrQ6YhKJXFhTe2kgu9pnFlR5Va0dlu9SD-GFCA/viewform",
  "links": {
    "discord": {
      "url": "https://discord.com/invite/a9JFBVTqgn",
      "name": "Discord",
      "description": "Join our community"
    },
    "github": {
      "url": "https://github.com/amblelabs",
      "name": "GitHub",
      "description": "Open source projects"
    },
    "codeberg": {
      "url": "https://codeberg.org/amblelabs",
      "name": "Codeberg",
      "description": "Open source projects"
    },
    "modrinth": {
      "url": "https://modrinth.com/organization/amble-labs",
      "name": "Modrinth",
      "description": "Browse our mods"
    },
    "youtube": {
      "url": "https://www.youtube.com/@amble_labs?sub_confirmation=1",
      "name": "YouTube",
      "description": "Watch our YouTube videos"
    },
    "tiktok": {
      "url": "https://www.tiktok.com/@amblelabss",
      "name": "TikTok",
      "description": "Watch our TikTok videos"
    },
    "bluesky": {
      "url": "https://bsky.app/profile/amblelabs.bsky.social",
      "name": "BlueSky",
      "description": "See mod updates and teasers"
    }
  },
  "donations": [
    {
      "name": "Loqor",
      "platform": "Ko-fi",
      "url": "https://ko-fi.com/Loqor",
      "icon": "kofi"
    },
    {
      "name": "Theo",
      "platform": "Boosty",
      "url": "https://boosty.to/dr.theo",
      "icon": "boosty"
    },
    {
      "name": "Duzo",
      "platform": "Ko-fi",
      "url": "https://ko-fi.com/duzoo",
      "icon": "kofi"
    },
    {
      "name": "Addie",
      "platform": "Patreon",
      "url": "https://www.patreon.com/cw/Addie_Astarr",
      "icon": "patreon"
    },
    {
      "name": "Classic",
      "platform": "Ko-fi",
      "url": "https://ko-fi.com/redpanda39441",
      "icon": "kofi"
    },
    {
      "name": "Wanzz",
      "platform": "Ko-fi",
      "url": "https://ko-fi.com/wazzaki_wanzz",
      "icon": "kofi"
    }
  ],
  "members": {
    "developers": [
      {
        "name": "Loqor",
        "role": "PM & Lead Developer",
        "avatar": "loqor.webp",
        "link": "https://loqor.dev",
        "socials": {
          "github": "https://github.com/loqor",
          "codeberg": "https://codeberg.org/loqor",
          "youtubeg": "https://www.youtube.com/channel/UCMCcRBw_pFgfc2Ixd98iNaA",
          "kofig": "https://ko-fi.com/Loqor"
        },
        "quote": "From dust we came, to dust we shall return."
      },
      {
        "name": "Theo",
        "role": "Lead Backend Developer",
        "avatar": "theo.png",
        "link": "https://theo.is-a.dev",
        "socials": {
          "github": "https://github.com/drtheodor",
          "codeberg": "https://codeberg.org/drtheo",
          "youtubeg": "https://www.youtube.com/channel/UC697odorPc6EM2FrvPg1Nfg",
          "boostyg": "https://boosty.to/dr.theo"
        },
        "quote": "theoretical"
      },
      {
        "name": "Saturn",
        "role": "Mod Director & QA Lead",
        "avatar": "saturn.png",
        "socials": {
          "github": "https://github.com/saturnorsomething",
          "codeberg": "https://codeberg.org/saturnorsomthing"
        },
        "quote": "if you then is? Yes or the no of the what? Yes infact the. Hello, everybody my name is mark my pliars and in todays video we'll"
      },
      {
        "name": "Hailrake",
        "avatar": "hailrake.webp",
        "role": "Senior Developer",
        "socials": {
        "discordg": "https://discord.com/users/375633631982387204"
        },
        "quote": "Sometimes, honestly admitting to yourself that everything is bad is far more brilliant than looking for reasons why everything is fine."
      },
      {
        "name": "Monke",
        "avatar": "monke.webp",
        "role": "Developer",
        "link": "https://monke.meme",
        "socials": {
          "github": "https://github.com/rapbattlegod32",
          "kofig": "https://ko-fi.com/monkedev"
        },
        "quote": "return to monke"
      },
      {
        "name": "Lakehascake",
        "avatar": "lake.webp",
        "role": "Developer",
        "link": "https://en.pronouns.page/@lakehascake",
        "socials": {
          "github": "https://github.com/lakehascake",
          "codeberg": "https://codeberg.org/lakehascake"
        },
        "quote": "yes, i do have cake, no, i don't mean like that."
      },
      {
        "name": "Pan",
        "avatar": "pan.jpeg",
        "role": "Developer",
        "socials": {
          "github": "https://github.com/mansarde",
          "codeberg": "https://codeberg.org/mansarde"
        },
        "quote": "Don't dwell in the past, always march onwards."
      }
    ],
    "artists": [
      {
        "name": "Avery",
        "avatar": "avery.webp",
        "role": "Lead Art Director",
        "link": "https://avery-pixel.carrd.co/",
        "socials": {
          "github": "https://github.com/Ouroboros-Games",
          "codeberg": "https://codeberg.org/ourogames"
        },
        "quote": "I'd rather be corny as myself than cool as somebody i'm not."
      },
      {
        "name": "Wanzz",
        "avatar": "wazz.png",
        "role": "Artist",
        "socials": {
          "x": "https://x.com/Wazzakii_W",
          "codeberg": "https://codeberg.org/WazzakiWanzz",
          "kofig": "https://ko-fi.com/wazzaki_wanzz"
        },
        "quote": "blue pink yellow whatever man just keep bringing me that shark (I like shark)"
      },
      {
        "name": "Tright",
        "avatar": "tright.webp",
        "role": "Artist",
        "quote": "Mamma mia!"
      },
      {
        "name": "Maggie",
        "avatar": "maggie.jpg",
        "role": "Artist",
        "quote": "if i kill myself ill know that a real bitch killed me"
      },
      {
        "name": "Classic",
        "avatar": "classic.png",
        "role": "Artist, Animator, Builder & Sound Designer",
        "socials": {
          "github": "https://github.com/pandawanda123",
          "codeberg": "https://codeberg.org/mightyredpanda",
          "kofig": "https://ko-fi.com/redpanda39441"
        },
        "quote": "would you like jellybaby?"
      },
      {
        "name": "Dian",
        "avatar": "dian.webp",
        "role": "Music & Sound Designer",
        "socials": {
          "github": "https://github.com/Dian-Vidus"
        },
        "quote": "I sold myself to Loqor"
      },
      {
        "name": "Lucien",
        "avatar": "lucien.webp",
        "role": "Music & Sound Designer",
        "link": "https://linktr.ee/someone.den",
        "quote": "We all change when you think about it. We're all different people, all through our lives, and that's okay, that's good, you've got to keep moving, so long as you remember all the people that you used to be."
      },
      {
        "name": "RatZoomie",
        "avatar": "ratzoomie.webp",
        "role": "Music & Sound Designer",
        "quote": "just my fucking pfp"
      },
      {
        "name": "Ember",
        "avatar": "ember.jpeg",
        "link": "https://emberspage.straw.page/",
        "socials": {
          "codeberg": "https://codeberg.org/Ember808",
          "github": "https://github.com/Ember808",
          "bluesky": "https://bsky.app/profile/ember808.bsky.social",
          "tumblr": "https://tumblr.com/blog/ember888"
        },
        "role": "Artist",
        "quote": "I am currently perpetrating many evil and gay crimes"
      },
      {
        "name": "Nanowu",
        "avatar": "nanowu.webp",
        "link": "https://nanuwo.github.io/",
        "socials": {
          "github": "https://github.com/nanuwo"
        },
        "role": "Artist",
        "quote": "nonuwo"
      },
      {
        "name": "K King",
        "avatar": "k_king.webp",
        "role": "Artist",
        "socials": {
          "x": "https://x.com/ItsKKing"
        },
        "quote": "LET ME OUT OF THIS WEBSITE PLEAS-"
      },
      {
        "name": "Ember",
        "avatar": "ember2.webp",
        "role": "Artist",
        "quote": "The better Ember."
      }
    ],
    "others": [
      {
        "name": "BungusBen",
        "avatar": "bungus.webp",
        "role": "Team & Social Manager",
        "socials": {
          "github": "https://github.com/OgMzsty",
          "youtubeg": "https://youtube.com/@tryzoffx",
          "tiktokg": "https://www.tiktok.com/@tryzoffx"
        },
        "quote": "I didnt know what Bung Meant until after i created my name..."
      },
      {
        "name": "VenWhoVian",
        "avatar": "ven.webp",
        "role": "Media Person",
        "socials": {
          "youtubeg": "https://youtube.com/@VenWhoVian"
        },
        "quote": "What do I do again?"
      },
      {
        "name": "Echo",
        "avatar": "echo.webp",
        "role": "Wiki Curator",
        "socials": {
          "github": "https://github.com/EchoDidAThing1048",
          "codeberg": "https://codeberg.org/EchoFinity"
        },
        "link": "https://echodidathing1048.github.io/",
        "quote": "Sometimes the best strategy is to hit your opponent really, really hard."
      },
      {
        "name": "Tree",
        "avatar": "tree.png",
        "role": "Wiki Curator",
        "socials": {
          "github": "https://github.com/trerrturyy"
        },
        "quote": "We have a wiki??"
      },
      {
        "name": "vmbbi (Max)",
        "avatar": "max.webp",
        "role": "Wiki Curator",
        "socials": {
          "github": "https://github.com/max7603",
          "codeberg": "https://codeberg.org/vmbbi"
        },
        "link": "https://vmbbi.is-a.dev/",